{
    "deltas": [
        {
            "fid": 1,
            "layerId": "points_c2784cf9_c9c3_45f6_9ce5_98a6047e4d6c",
            "method": "patch",
            "new": {
                "attributes": {
                    "int": 666
                }
            },
            "old": {
                "attributes": {
                    "int": 134
                }
            }
        }
    ],
    "files": [],
    "id": "6f109cd3-f44c-41db-b134-5f38468b9fda",
    "projectId": "e02d02cc-af1b-414c-a14c-e2ed5dfee52f",
    "version": "1.0"
}
